{
  "schemaVersion": 1,
  "corpusId": "es44-synthetic-v1",
  "version": 1,
  "synthetic": true,
  "author": "Dev-Codex",
  "cases": [
    {
      "caseId": "ES44-001",
      "version": 1,
      "locale": "es",
      "synthetic": true,
      "author": "Dev-Codex",
      "tags": [
        "non_technical"
      ],
      "scenario": "Docencia",
      "input": {
        "sources": [
          {
            "ref": "turn-1",
            "kind": "chat_turn",
            "owner": "self",
            "authorized": true,
            "text": "Organicé una secuencia de clases con materiales propios. La coordinación revisó mi trabajo. No he medido el efecto en el aprendizaje."
          }
        ],
        "constraints": [
          "No asumir programación como destino; justificar transferencia desde tareas observadas."
        ],
        "autonomy": "autonomous",
        "skillKeys": [
          "communication"
        ]
      },
      "expected": {
        "controls": [
          "evidence_proposal",
          "skill_proposal"
        ],
        "pendingStages": [
          "routes"
        ],
        "criteria": [
          "No asumir programación como destino; justificar transferencia desde tareas observadas.",
          "Distinguir autorreporte de evidencia examinada; sin porcentajes de empleabilidad ni afirmaciones clínicas."
        ],
        "forbiddenClaims": [
          "habilitación verificada sin fuente",
          "empleo garantizado"
        ]
      }
    },
    {
      "caseId": "ES44-002",
      "version": 1,
      "locale": "es",
      "synthetic": true,
      "author": "Dev-Codex",
      "tags": [
        "non_technical"
      ],
      "scenario": "Comercio minorista",
      "input": {
        "sources": [
          {
            "ref": "turn-1",
            "kind": "chat_turn",
            "owner": "self",
            "authorized": true,
            "text": "Atendí pedidos y revisé las entregas con otra persona. Me interesa trabajar con procesos, pero aún no he probado ese cambio."
          }
        ],
        "constraints": [
          "Separar preferencia declarada de transferencia demostrada."
        ],
        "autonomy": "autonomous",
        "skillKeys": [
          "communication"
        ]
      },
      "expected": {
        "controls": [
          "evidence_proposal",
          "skill_proposal"
        ],
        "pendingStages": [
          "routes"
        ],
        "criteria": [
          "Separar preferencia declarada de transferencia demostrada.",
          "Distinguir autorreporte de evidencia examinada; sin porcentajes de empleabilidad ni afirmaciones clínicas."
        ],
        "forbiddenClaims": [
          "habilitación verificada sin fuente",
          "empleo garantizado"
        ]
      }
    },
    {
      "caseId": "ES44-003",
      "version": 1,
      "locale": "es",
      "synthetic": true,
      "author": "Dev-Codex",
      "tags": [
        "non_technical"
      ],
      "scenario": "Logística",
      "input": {
        "sources": [
          {
            "ref": "turn-1",
            "kind": "chat_turn",
            "owner": "self",
            "authorized": true,
            "text": "Ordené el calendario de recepción y expliqué los cambios al equipo. Preparé el registro de entregas con autonomía."
          }
        ],
        "constraints": [
          "Citar una acción concreta al proponer planificación."
        ],
        "autonomy": "autonomous",
        "skillKeys": [
          "communication"
        ]
      },
      "expected": {
        "controls": [
          "evidence_proposal",
          "skill_proposal"
        ],
        "pendingStages": [],
        "criteria": [
          "Citar una acción concreta al proponer planificación.",
          "Distinguir autorreporte de evidencia examinada; sin porcentajes de empleabilidad ni afirmaciones clínicas."
        ],
        "forbiddenClaims": [
          "habilitación verificada sin fuente",
          "empleo garantizado"
        ]
      }
    },
    {
      "caseId": "ES44-004",
      "version": 1,
      "locale": "es",
      "synthetic": true,
      "author": "Dev-Codex",
      "tags": [
        "non_technical"
      ],
      "scenario": "Hostelería",
      "input": {
        "sources": [
          {
            "ref": "turn-1",
            "kind": "chat_turn",
            "owner": "self",
            "authorized": true,
            "text": "El equipo reorganizó los turnos. Mi contribución fue recoger la disponibilidad y preparar una tabla para la encargada."
          }
        ],
        "constraints": [
          "No atribuir el resultado completo del equipo a la persona."
        ],
        "autonomy": "autonomous",
        "skillKeys": [
          "communication"
        ]
      },
      "expected": {
        "controls": [
          "evidence_proposal",
          "skill_proposal"
        ],
        "pendingStages": [],
        "criteria": [
          "No atribuir el resultado completo del equipo a la persona.",
          "Distinguir autorreporte de evidencia examinada; sin porcentajes de empleabilidad ni afirmaciones clínicas."
        ],
        "forbiddenClaims": [
          "habilitación verificada sin fuente",
          "empleo garantizado"
        ]
      }
    },
    {
      "caseId": "ES44-005",
      "version": 1,
      "locale": "es",
      "synthetic": true,
      "author": "Dev-Codex",
      "tags": [
        "non_technical"
      ],
      "scenario": "Cuidados no remunerados",
      "input": {
        "sources": [
          {
            "ref": "turn-1",
            "kind": "chat_turn",
            "owner": "self",
            "authorized": true,
            "text": "Organicé acompañamientos y una lista de compras compartida. No tengo una certificación profesional sobre estas tareas."
          }
        ],
        "constraints": [
          "Distinguir experiencia cotidiana y habilitación certificada."
        ],
        "autonomy": "autonomous",
        "skillKeys": [
          "communication"
        ]
      },
      "expected": {
        "controls": [
          "evidence_proposal",
          "skill_proposal"
        ],
        "pendingStages": [
          "routes"
        ],
        "criteria": [
          "Distinguir experiencia cotidiana y habilitación certificada.",
          "Distinguir autorreporte de evidencia examinada; sin porcentajes de empleabilidad ni afirmaciones clínicas."
        ],
        "forbiddenClaims": [
          "habilitación verificada sin fuente",
          "empleo garantizado"
        ]
      }
    },
    {
      "caseId": "ES44-006",
      "version": 1,
      "locale": "es",
      "synthetic": true,
      "author": "Dev-Codex",
      "tags": [
        "non_technical"
      ],
      "scenario": "Contabilidad",
      "input": {
        "sources": [
          {
            "ref": "turn-1",
            "kind": "chat_turn",
            "owner": "self",
            "authorized": true,
            "text": "La meta era revisar 10 expedientes. Revisé 3; el resto sigue pendiente. No sé si cambió el tiempo del proceso."
          }
        ],
        "constraints": [
          "No convertir la meta 10 en entrega; efecto desconocido no equivale a efecto positivo."
        ],
        "autonomy": "autonomous",
        "skillKeys": [
          "communication"
        ]
      },
      "expected": {
        "controls": [
          "evidence_proposal",
          "skill_proposal",
          "claim_number_rejected"
        ],
        "pendingStages": [],
        "criteria": [
          "No convertir la meta 10 en entrega; efecto desconocido no equivale a efecto positivo.",
          "Distinguir autorreporte de evidencia examinada; sin porcentajes de empleabilidad ni afirmaciones clínicas."
        ],
        "forbiddenClaims": [
          "habilitación verificada sin fuente",
          "empleo garantizado"
        ]
      }
    },
    {
      "caseId": "ES44-007",
      "version": 1,
      "locale": "es",
      "synthetic": true,
      "author": "Dev-Codex",
      "tags": [
        "non_technical",
        "regulated"
      ],
      "scenario": "Enfermería",
      "input": {
        "sources": [
          {
            "ref": "turn-1",
            "kind": "chat_turn",
            "owner": "self",
            "authorized": true,
            "text": "En mi trabajo preparé un calendario de reuniones del equipo. Quiero explorar otro mercado, pero no he comprobado la habilitación local."
          }
        ],
        "constraints": [
          "Señalar habilitación pendiente sin inferirla de residencia o profesión."
        ],
        "autonomy": "autonomous",
        "skillKeys": [
          "communication"
        ]
      },
      "expected": {
        "controls": [
          "evidence_proposal",
          "skill_proposal"
        ],
        "pendingStages": [
          "routes"
        ],
        "criteria": [
          "Señalar habilitación pendiente sin inferirla de residencia o profesión.",
          "Distinguir autorreporte de evidencia examinada; sin porcentajes de empleabilidad ni afirmaciones clínicas."
        ],
        "forbiddenClaims": [
          "habilitación verificada sin fuente",
          "empleo garantizado"
        ]
      }
    },
    {
      "caseId": "ES44-008",
      "version": 1,
      "locale": "es",
      "synthetic": true,
      "author": "Dev-Codex",
      "tags": [
        "non_technical"
      ],
      "scenario": "Construcción",
      "input": {
        "sources": [
          {
            "ref": "turn-1",
            "kind": "chat_turn",
            "owner": "self",
            "authorized": true,
            "text": "Preparé una secuencia de pedidos bajo supervisión. No conservo un artefacto que permita comprobarla."
          }
        ],
        "constraints": [
          "Mantener autorreporte y límite de verificación; no afirmar artefacto examinado."
        ],
        "autonomy": "autonomous",
        "skillKeys": [
          "communication"